{
  "hazard_id": "37c0a901-d604-4f7b-84a0-3c230ca02150",
  "source": "PVMBG",
  "source_ref_id": "demo-volcanic-001",
  "hazard_type": "VOLCANIC",
  "severity": "SIAGA",
  "area_name": "Gunung Simulasi Red Mountain (Tamriel)",
  "latitude": -7.0,
  "longitude": 108.0,
  "occurred_at": "2026-09-25T13:59:50Z",
  "ingested_at": "2026-09-25T14:00:05Z",
  "attributes": {
    "volcano_id": "sim-tamriel-red-mountain",
    "eruption_count_24h": 2,
    "ash_column_height_m": 500.0,
    "confidence_level": 0.9
  }
}
